text,annotation_7,annotation_8,annotation_9,annotation_78,annotation_62
"40 years ago, when one of our class of graduate students contracted tuberculosis, all of us, students, faculty, and staff were required to line up for TB tests.  They didn't ask if we wanted it, they didn't ask if we believed in it, they didn't ask if we were scared of it (one faculty member passed out from needlephobia).

Stop treating these babies like adults. Tell them to get vaccinated or find another job.",pro-mitigation,,pro-mitigation,pro-mitigation,pro-mitigation
"I wasn’t allowed to burn leaves in my yard because doing so would burden the health and well-being of my neighbors. I could cite dozens of similar examples of how we all accept limitations on our freedom of behavior in order to live in a safe and well-ordered society. 

Today’s emphasis on ""privacy"" and individual ""rights"" has gone to extreme, one that the ignores the common good—in this case, the very lives of our coworkers—and one spurred on by a legal industry just salivating at the thought of all those vaccination-related lawsuits.",pro-mitigation,,unclear,pro-mitigation,pro-mitigation
"Just read:
“ Pfizer and the German company BioNTech have become the first companies to apply to the U.S. Food and Drug Administration for full approval of their Covid-19 vaccine for use in people 16 and older. The vaccine is currently being administered to adults in America under an emergency use authorization granted in December.

The approval process is likely to take months...

It could also make it easier for companies, government agencies and schools to require vaccinations. The Equal Employment Opportunity Commission said in December that employers could mandate vaccination, and legal experts have generally agreed.”

So we are months away from most or all companies, government agencies and schools requiring vaccinations.

For each individual, getting vaccinated as soon as possible - even under FDA emergency (not full) authorization remains the right thing to do, so we can collectively achieve herd immunity via vaccinations (as opposed to infections and death) as soon as possible.",pro-mitigation,,pro-mitigation,pro-mitigation,pro-mitigation
"I am tired of hearing about ""delicate balances"" and individual rights.  This is a PANDEMIC, folks.  Do you understand the implications of the concept?  There are sectors where the safety of the people requires vaccination: airlines, health care, food services.  What if we stop requiring basic sanitary practices so not no offend anyone?  What if we allow crews potentially carrying covid in a flying sealed tube where, no matter what, you will very likely breath air cotaining the virus exhaled by a member of that crew?  Your right to risk your life ends where the risk you assumed threatens the rest of us.",pro-mitigation,,anti-mitigation,pro-mitigation,pro-mitigation
"You should not be required to go to an office that can’t verify whether the people inside are vaccinated from COVID, because it is highly contagious.",pro-mitigation,,anti-mitigation,pro-mitigation,pro-mitigation
"I think there are safe ways to eat outside spaces appropriately. I have done it multiple times and will continue to do so. As long as you are not sitting close to any other tables, waiter is masked and you are wearing a mask when you are anywhere about your table there truly is low risk and I don’t think anyone has any actual data to say otherwise. ￼￼Like the article states there are no outbreaks attributed to eating at a restaurant outdoors. Indoors and crowded bars are completely different story. ￼￼￼",unclear,,pro-mitigation,pro-mitigation,unclear
"This 'medical privacy' thing is out of control. Employers have the right to require employees be vaccinated, and we customers have the right to know if we're shopping/eating at an establishment where all employees have been vaccinated.",pro-mitigation,,pro-mitigation,pro-mitigation,pro-mitigation
"I very much enjoy restaurants but have patronized only take-out from my favorites since February.

Think back to your time in college.  How often did you go to restaurants and bars?  My food and drink palate has changed considerably, but the local bars and affordable greasy spoon restaurants got my dollars back in those days.  The associated independence and freedom of choice was a rite of passage.  After reflecting on that time in your life, tell me, how much will any open college town bars/restaurants be patronized with non-social distancing students these days and what will be the price?",pro-mitigation,,pro-mitigation,anti-mitigation,unclear
"Some observations from an elderly South Floridian:

First, the recent surge down here --now apparently easing-- is predominantly due to teens and millennials partying.  Closing the bars --obviously a sensible notion -- moved the drinkathons to private residences.

Second, all restaurants are not the same.  Many don't serve alcoholic beverages, ergo they don't attract crowds.  Our occasional recent forays into local favorites have found them virtually empty, otherwise we wouldn't go in.  Easy to maintain social distancing under those circumstances; hard to see how long they can remain in business.

Third, mask usage in stores now seems ubiquitous, a good thing.  I do wish the media would let their readers know a dirty little secret from the contact tracers:  They focus on prolonged exposure --five to fifteen minutes -- at close quarters.  It would help many feel a little more secure about their grocery shopping.",pro-mitigation,,pro-mitigation,pro-mitigation,pro-mitigation
Require new ID badges to enter the company premises as of a certain date say 6 months out. That's a lot of lead time. To get the new ID badge you have to show proof of having completed COVID vaccination. This provides all who work at the company with a safer workplace. When the company does this the vaccine hesitaters will jump through hoops to get vaccinated. The new badge gives employees a visual reminder that they work for a company that stands for a safer workplace. End of discussion and we all move on. See: Real ID for drivers licenses and air travel.,pro-mitigation,,pro-mitigation,pro-mitigation,pro-mitigation
"Just to add to the experience/approach in Saskatchewan, I think the comments this week of the newly installed Chief Medical Officer of the Province of Ontario are worth noting.

IN my Province we now have about 80% of the adult population with at least one COVID 19 vaccination shot., and close to 40% of the same population fully vaccinated with 2 shot.

The pressure to speed opening up and relaxation of health measures is overwhelming, but public health officials are finally being listened to by politicians  (having gone through a 3rd wave.

The Chief medical Office said ""On average ""delta"" wants to go from one person, to six, to thirty six to two hundred fifteen in a 1 to 5 day cycle. For all these reasons we need to be cautious, we need to be prudent and we need that 21 days [pause between phases of opening up] to understand the impact... We never want to take a step backward. We only want to be moving forward"".

I received by second shot this morning, and with it came a fact sheet that cautioned me to continue with distancing and mask wearing protocols.",pro-mitigation,,pro-mitigation,pro-mitigation,pro-mitigation
"two frustrations with the article:

why not talk to companies and employees who work where the flu vaccine is already required? this reads as if we have no experience with this issue.

secondly, you write that employers worry that they will lose employees if they mandate vaccines ... no word about employees who will come back ONLY if the vaccine IS mandated. I think the number of people who will want to work where the vaccine is mandated is high, yet you completely ignored it for this article.",pro-mitigation,,pro-mitigation,pro-mitigation,pro-mitigation
"Unvaccinated Americans perpetuate Covid spread and ultimately virus mutations by not shutting down the spread of the disease. The fears of the vaccine can be easily and objectively disproven with scientific medical data. 

This article talks at length about legal exposure to companies mandating vaccinations. But what about the legal and medical risks for not having a mandate? Doesn’t that imply that your organization is not taking reasonably precautions to keep you workforce safe? And realistically isn’t that a far larger problem?

I heard a lawyer speaking a few days ago. He wanted to mandate vaccinations for all his staff at his firm. His HR department said he would have to make accommodations for those who wouldn’t comply. He decided to let those staff work remotely but they would have to have a camera on them at all times during the work day. I’m sure the recalcitrant would hate that. I think it’s a brilliant solution within the acceptable boundaries.",pro-mitigation,,unclear,pro-mitigation,pro-mitigation
"We need to step back and think about why viruses such as influenza and Covid are around in the first place.  It's natures way of strengthening a species, culling the weak and the sick.  There's nothing like a good pandemic to naturally reduce the human carbon footprint upon the earth.  So let the smarter ones take the vaccine and let nature have free rein on those not so inclined to do so.  After all, isn't stronger, faster, smarter what we're all about anyway?",unclear,,pro-mitigation,unclear,unclear
"I’m vaccinated...but I do understand some people’s arguments (younger, liberal folks included) against immediate vaccination. I’d say a good percentage of current unvaccinated people plan to get a jab eventually but are waiting a bit longer to see if there are any adverse results that haven’t been detected/reported yet. We are at, what, 40 percent vaccinated currently? Maybe in a month or two, when 65 percent is inoculated and just fine, more will be persuaded. Of course, in the meantime that increases the chances of Covid variants developing, putting us ALL back to Square 1...but I can see the concerns of not wanting to be the guinea pig for a fast tracked concoction.",unclear,,pro-mitigation,unclear,unclear
"There are a number of commenters who are saying that unvaccinated people can still cause vaccinated individuals to become sick with COVID. They really can’t. They may cause them to be infected, mostly asymptotically, and almost never with severe illness. So, while we should be disappointed, even angry, with the unvaccinated for not doing their part to reduce the spread of COVID, we should not fear them as vectors who will cause us (or our elderly, vaccinated parents) to die.  And please don’t invoke variants here. There is mounting evidence that the vaccines approved in the US protect against variants.",unclear,,anti-mitigation,pro-mitigation,pro-mitigation
"If you are vaccinated and basically healthy your odds of ""breakthrough infection"" are low and will almost certainly be totally asymptomatic or so mild as to make no difference. Moreover you are highly unlikely to spread the disease even the new variants. 

Going into a panic and reinstituting mask mandates as LA County is doing undermines credibility and accomplishes nothing.

Far better to just keep people informed and remind those who are very elderly or have compromised immune systems that even if vaccinated a mask is prudent indoors for that particular group. 

Life is not a zero risk game. If my risk = low chance of an infection that I most likely won't even know I have that will do me no harm and is highly unlikely to be passed to others...

I'm not wearing that thing on my face in 100 degree heat. 

Period.",anti-mitigation,,anti-mitigation,unclear,anti-mitigation
"We need to step back and review how much credence we've given the crazies - the anti-vaxxers, the big lie believers... Sane folks need to value what is right and ensure that society at large benefits from what is right. Enough coddling the crazies, just because they exist in great numbers. We need to get back into the driver's seat and put the crazies somewhere safe. We will continue to live in pandemic times unless we all comply with sound public health measures - enforced by whatever legal means we have available.",pro-mitigation,,unclear,pro-mitigation,pro-mitigation
"I am retired physician and immunocompromised .Mask  wearing ,hand washing and respectable distancing is the cheapest and probably the most effective way of prevention.For me it is my religion and for anyone who wants to  spend time with me.

highest price /earnings ratio !!!",pro-mitigation,,pro-mitigation,pro-mitigation,pro-mitigation
WHO and CDC have lost a lot of credibility. Should never have said take off masks once vaccinated in the first place. Way too late to put that horse back in the barn.,pro-mitigation,,anti-mitigation,pro-mitigation,unclear
"I’m sitting outside at a NYC restaurant right now - it is a nice night out, people are enjoying the meal, restaurant workers are getting a much needed paycheck. The increases in Covid cases was really due to very crowded indoor *bars* that masqueraded as restaurants, mainly in states that never reduced their COVID cases enough. In states where they reduced COVID cases and have introduced indoor dining, like Maine, it hasn’t been an issue.

At the end of the day, we all need to figure out ways to restart normal activity - schools, work, and yes, restaurants - while implementing precautions (masks, cleaning, testing) and being safe.",unclear,,anti-mitigation,pro-mitigation,pro-mitigation
"""To get federal aid, restaurants were first required to spend 75 percent of that relief on payroll ... But the only way this was useful to businesses, restaurant owners said, was if they were able to reopen and generate revenue in that period, which was nearly impossible.""

So many business owners can't understand the rationale behind the Paycheck Protection Program!  

The money was not provided so you could stay open, it was provided so you could keep your workers on the payroll while you were shut down.",pro-mitigation,,pro-mitigation,pro-mitigation,pro-mitigation
"If companies make people return to work, then they must make vaccination mandatory and available. We seem to have lost perspective. We are in a public health emergency. Previously with vaccination refusal, it was a case of religious beliefs, not a political statement.",pro-mitigation,,unclear,pro-mitigation,pro-mitigation
I would like to see the numbers on barber shops and salons in their reopening.  As educated and licensed professionals in my state their practices of infection control was that of trained professionals. I think they may have been unfairly targeted as places the virus spreads.,unclear,,anti-mitigation,unclear,unclear
"Consumers and companies are ultimately paying for medical costs. The allowance of a multi-million dollar claim for a Covid incident is not good policy by any employer, self insured or not. While a governmental requirement for vaccines would not go over well, the requirement for vaccines by an employer would be understood - get the vaccine or give up your job. Employers need to step up to the plate and make the vaccine a requirement.",pro-mitigation,,pro-mitigation,pro-mitigation,pro-mitigation
Not discussed here is how economists estimate that over 80% of small business owned restaurants (many by minority groups) will not survive into next year. That economic hit and its impact on funding our government programs will lead to a public health crisis of its own (think deaths of despair) on top of the existing mental health crisis of our youth from the measures already taken by state and local governments (not just Trump.),unclear,,unclear,unclear,unclear
"I think it will still be difficult to force somebody to take a vaccine that is designated ""Emergency Use Authorization"" which means it does not have full approval.

Pfizer and BioNTech asked the Food and Drug Administration Friday for full approval of the companies' Covid-19 vaccine. If approved, it would be the first Covid-19 vaccine in the United States to hold that distinction.

There are no other vaccines that are required that do not have full approval.  To compare one of the Covid vaccines (which is EUA) to any other vaccine (with a BLA) like MMR, polio, pneumonia, flu, etc. is not a valid comparison because they are all fully approved.

For example, there are different evidentiary requirements for licensure of a Biologics License Application (BLA) and issuance of an EUA for a vaccine. Furthermore, an EUA expires upon termination of the relevant emergency declaration, whereas there is no “termination” of a BLA.

Likewise, if there were problems (like with J&J) with a fully approved vaccine there would not just be a week or 2 pause with a recommendation to not use - instead there would be a recall.

I assume once the Covid vaccines are fully approved there will be less resistance.",pro-mitigation,,pro-mitigation,unclear,unclear
"“But the short-term gains have led to broader losses.”

The American national motto, not just in the time of COVID but in the 21st century. That can go on our tombstone.",unclear,,unclear,unclear,pro-mitigation
"Expose the antivaxxer crowd as the disruptive ne'er-do-wells they truly are.

Don't let them in the office, in stadiums, stores, schools or restaurants.

Let them enjoy their choices as social pariahs.",pro-mitigation,,anti-mitigation,pro-mitigation,pro-mitigation
"We are so concerned with protecting others lives but not the ones in the womb.  

Abortion is a choice and believe it should continue to be. 

Vaccinations should be my choice right...my body.",anti-mitigation,,anti-mitigation,anti-mitigation,anti-mitigation
"Should an employer allow an employee at their workplace to fire a gun randomly at various intervals while working throughout the day?  I do not think so.  What is the difference when an unvaccinated  employee comes in and interacts with other employees and customers?  Catching this virus may result in a minor inconvenience for some, lifetime problems for others, and death for others.  Same results as a gun shot wound.",pro-mitigation,,unclear,pro-mitigation,pro-mitigation
"Every day I become angrier and angrier about the anti-vaxxers. Even though I’m vaccinated, the Delta variant could potentially be dangerous for me. When did this country become so crazy? Oh, yeah. Trump (and the internet).",pro-mitigation,,unclear,pro-mitigation,pro-mitigation
"As the current data show, those who are vaccinated are unlikely to be infected and thus become possible spreaders of the Covid19 virus. Being vaccinated is not a matter of personal privacy or any other personal anything. Vaccination is a matter of public health. Those who are not vaccinated should not be permitted to use any public facilities. Get over it anti-vaxxers. Believe whatever cult theories you choose to believe. But keep you potentially lethal exhalations in the privacy of your own home. GET VACCINATED OR STAY HOME.",pro-mitigation,,pro-mitigation,pro-mitigation,pro-mitigation
"If you are not vaccinated you are susceptible to getting Covid 19 and infecting other people, including those who have been vaccinated. Why do you have the right to make other people ill, or even die, by spreading an illness that is so virulent and can cause very serious long-term side effects? At the very least, companies/employers should be required to know which employees are vaccinated and which are not, and require workers not vaccinated to wear masks and social distance.  

I fail to see why my right to stay alive should be superseded by your failure to vaccinate. Why is it not an invasion of my privacy to be forced to associate with people who may be spreading the virus and putting me at risk? Why is it an invasion of your privacy to require you do something that will protect yourself and the people around you? Especially since it is increasingly clear that the vaccines are safe and extremely effective, as the is shown by the dropping numbers of cases and reduction of illness and death.",pro-mitigation,,pro-mitigation,pro-mitigation,pro-mitigation
"Reading these comments. No one knows the long term effects of the vaccine.... don't dismiss people's concerns. That's part of our problem. I am vaccinated and 100% for them, as their efficacy has been proven. The alternative is a covid-mutating virus that will be here for ever..... so the risks outweigh the fears in my opinion... but you don't convince someone who is afraid by dismissing their concerns. Especially when they are valid.  I also wonder about mandating a vaccine that is only approved for emergency use only... I think it's just a matter of time before full FDA approval but I do think you can't mandate any vaccine that is just for emergency use only, there must me a legal precedent there? Stay safe folks but LISTEN as well",pro-mitigation,,pro-mitigation,unclear,unclear
"It is all about public health in a pandemic not individual freedom. 

Hey you are free to rob a bank, drive 110 MPH but does a reasonable person?

I am sure healthcare insurance companies are watching and will price the healthcare risks, short term and long term, of not get a vaccine.",unclear,,pro-mitigation,unclear,pro-mitigation
"At my clinic, I’ve had a few folks who work in high risk industries like nursing homes and factories, tell me “I’ll get vaccinated when my employer requires it.” So once the vaccine is past “emergency use authorization,” I hope employers require it. We healthcare workers have been required to get the flu vaccine for years, and flu is a much smaller risk than Covid19. Also, the flu shot is much less effective that the Covid19 vaccine.",unclear,,pro-mitigation,pro-mitigation,pro-mitigation
"I stayed home for a year, never got COVID and am fully vaccinated. I have rights too. I have a right  to not be on a plane with unvaccinated people. I have a right  to not be cared for in a medical facility by unvaccinated people. I do not want to patronize a restaurant where the staff is unvaccinated. I have a right to know. I have a right  to not share office space with the unvaccinated.  I have a right to be safe at work. I do not want my kids to do virtual school so I expect students who want to be on campus to be vaccinated. The kids and young adults who are vaccinated have rights too. Health systems mandate flu shots and should mandate COVID vaccines. If businesses do not mandate there are other ways to incentivize. The unvaccinated can work from home or share their own floor and mask at work. The vaccinated have a right to a full life and vibrant economy.",pro-mitigation,,pro-mitigation,pro-mitigation,pro-mitigation
"This is simple-  
Viruses are inherently weak and can not survive on their own.
They need a host to continue to survive.
Each time they hop to a new host they have the opportunity to mutate.
Mutations are unpredictable. 
Viruses can mutate into something stronger and more resistant to vaccines and meds. (Think antibiotics)
Wearing masks is a one very simple way to keep the virus from finding hosts.",pro-mitigation,,pro-mitigation,pro-mitigation,pro-mitigation
"No one should eat in a restaurant, ever.  Even without the pandemic.  Junk food, expensive junk food.

Bars should not exist.  No respectable person goes to a bar.  Alcohol is for the family dinner table, in moderation, and for nowhere else.",unclear,,unclear,unclear,unclear
"Easy solution. Until the vaccine goes away.

If you get the vaccine you can work in the office.

If you will not get the vaccine you work from home.

Until the virus goes away no other alternative.",pro-mitigation,,pro-mitigation,pro-mitigation,unclear
So much security theater while the most vulnerable still lack non-bankruptcy-inducing health care or government assistance to keep them home if sick.,pro-mitigation,,unclear,anti-mitigation,unclear
"Avoiding restaurants will fatten your wallet and lighten your weight, instead of the other way around.",unclear,,unclear,unclear,unclear
"In Galapagos, ALL expedition cruise ship employees are being vaccinated as I type.  No issue there.   It's good for you, it's good for your family, for your community, and it will be good for business.   PLEASE make them mandatory, otherwise there will be on-going outbreaks, that will force never ending closures.",pro-mitigation,,pro-mitigation,pro-mitigation,pro-mitigation
Companies can’t demand inoculation however they can bring them on site and provide time for the employees to receive it. That’s how it works for mammograms and basic flu shots,pro-mitigation,,pro-mitigation,anti-mitigation,pro-mitigation
"This article is about where outbreaks have come from, but I don't think the headline that bars and restaurant owners wanted to get back to work is accurate. Bars and restaurant owners have felt compelled to reopen in some capacity due to the lack of support required at the state or federal level (PPP has been problematic and not the financial or legislative fix needed to save bars and restaurants). The effort required to pivot a million times, keep employees safe, and try to meet pre-pandemic expectations from guests has created constant stress, and it's not profitable. And because the take out only scenario is really, really not profitable, we end up with businesses making irresponsible decisions about dine-in. But when the alternative is shutting down, defaulting on one's lease, and risking a lawsuit from the property owner (a real threat), what does one do but keep going? Five months in and few have received the concessions needed from their landlords to feel confident about their businesses making it thru the coming fall and winter.",unclear,,anti-mitigation,anti-mitigation,unclear
