text,annotation_7,annotation_8,annotation_9,annotation_78,annotation_62
"The majority of the people in favor of mandatory vaccine's make the argument that, ""if I got it, so must you."" Bodily autonomy, ""my body, my choice,"" and ""no means no,"" are out the window! This is all for a virus with 99.8% survival rate. Goodbye civil liberties, constitutional amendments and hugging grandma. Good grief!",pro-mitigation,,pro-mitigation,anti-mitigation,anti-mitigation
"The CDC, presumably at the urging of the Biden administration for political and economic reasons, really botched this one. By telling vaccinated people they could go without masks at all times, but providing no means of telling the vaccinated from the unvaccinated, it was an invitation for all to discard masks. How could you not know that the first ones to discard would be the unvaccinated, who deny the virus anyway? I'm fully vaccinated but have never gone into a store, etc. where there are people I don't know. It's not a big deal except for people who want to put their ""freedom,"" actually ignorance, on display.",pro-mitigation,,anti-mitigation,unclear,unclear
"I hope that hospitals move toward making it required for staff—nurses, doctors, all of us that take care of patients.  But the reality is that so many health care workers quit this year already, the already present shortage is now greatly exacerbated.  Losing 10 or 20% of more staff who refuse the vaccine isn’t something hospitals can handle.  Though I personally would be happy to have fewer conspiracy minded coworkers.  The supply and demand of workers will determine how mandatory many places make the vaccine.",unclear,,pro-mitigation,pro-mitigation,unclear
And yet it's accepted that companies can test employees' urine for traces of weed.,pro-mitigation,,unclear,pro-mitigation,unclear
Employers are worried about being sued if their worker has an ill effect from the vaccine. What if an employee gets seriously ill from having contracted Covid at work?,unclear,,unclear,unclear,unclear
"I’m fully vaccinated so if I need to wear a mask, what is the point of getting vaccinated. If it’s to protect the unvaccinated who can’t get shots, they’re probably wearing masks to protect themselves. If the concern is about those who refuse to wear a mask, sorry, I have no sympathy for these people. Unless the Pfizer and Moderna vaccines aren’t effective against this variant or future more transmissible variants and except where required (medical facilities, for example), I don’t intend to wear a mask.",anti-mitigation,,anti-mitigation,unclear,unclear
"What Los Angeles has done is irresponsible, because it undermines already shaky public confidence in both national and local public health authorities. It's crying wolf, and when the real wolf comes people won't know what to do. And it ignores everything that scientists (of whom I'm aware say): if you're vaccinated you have a very small chance of contracting COVID at all, and if you do it won't be severe, and you have no chance of transmitting it. So the message Los Angeles SHOULD be sending is: If you're not vaccinated you should wear a mask; if you're vaccinated there's no reason to do so. And if THAT is too hard for people to understand, they shouldn't be walking around. The Los Angeles announcement is likely to reduce the incentive for people to get vaccinated, because they're essentially saying it doesn't matter.",pro-mitigation,,anti-mitigation,pro-mitigation,pro-mitigation
"Since COVID still enters the body (the vaccines only prevent a severe illness from COVID), I'm guessing it can also cause ""long-COVID"" meaning organ damage and brain fog.  So...I'll be the one on wearing a mask on the streets and when jogging around the reservoir!",,pro-mitigation,pro-mitigation,pro-mitigation,pro-mitigation
Just do it. Just put on a mask. It also seems some of the anti maskers would be more appealing with a mask on.,pro-mitigation,,pro-mitigation,pro-mitigation,pro-mitigation
"How many times have we heard someone declare “I know my rights” at the top of their lungs. Constitutionality is big, with everyone injecting his or her own interpretation of the term. What so many of us are rejecting is the concept of the common good. Rejecting the vaccine is akin to spitting in your co-worker’s face, in fact stating that you don’t care what happens as long as you get your way. Infantile? Of course, but very much in Vogue in our country these days. No problem rejecting something that would eventually benefit everybody. Too much government! Too much regulation! Too many rules to live by. No authority can tell me what to do! But don’t forget to send me my stimulus check! And, by the way, keep that army of young men and women ready to defend me while I catch a game and have a beer. What has America come to?",pro-mitigation,,unclear,pro-mitigation,anti-mitigation
"Closing things because of Covid-19 has hurt a lot of people, but the deepest and longest-lasting harm has been done to millions of school children.  Can we not prioritize them, even if that puts the livelihoods of some bar and restaurant employees  at risk? I'd even be willing to focus more of my tax dollars towards those businesses we most intentionally must ""harm"" in order to reduce infection rates enough to reopen our schools.",pro-mitigation,,pro-mitigation,pro-mitigation,pro-mitigation
"Let's be honest, this is a political issue, not one of vaccine safety.  Hundreds of millions have had these injections without serious ill effects, and vaccine efficacy has been demonstrated not only in controlled clinical trials but through a dramatic decrease in COVID rates among the general population.  Moreover, we've already seen that doing nothing causes even more harmful viral variants to emerge. 

One one side we have anti-vaxxers who want to ignore the facts and make a political statement.  On the other are the rest of us who want to stop a disease that has killed almost 600,000 Americans and caused unimaginable hardship for many times this number.  It's pretty clear which side is right, and I think corporations are being spineless in not stepping up and just requiring the shots.",pro-mitigation,,unclear,pro-mitigation,pro-mitigation
"The article makes no mention of CT which had indoor dining and hasn't seen its cases rise.  Instead of just staying that indoor dining is bad,  wouldn't it make more sense to see why it works someplaces and not others.",anti-mitigation,,unclear,pro-mitigation,unclear
"My 91 year old mother, who has lived alone for the pandemic, and who is vaccinated, was in the workshop yesterday of a man who was repairing a table for her. She was masked, he was not. He asked if she believed in vaccinations. She said, "" Of course I do. I am 91."" He said he was not going to get vaccinated. She said, "" Then you ought to wear a mask."" He said he didn't believe in masking either. 

When her table is fixed, he will lose her business, and that of everyone we tell. Here's the thing: is he not liable if he infected my mother the other day? Why not? 

Public health is about the community. By getting vaccines, we take care of each other. Not requiring vaccines ensures the virus is here to stay: continuing economic disruption, endangering lives. This is not complicated --the virus is not political and is certainly not interested in personal rights...it's just looking for a host.

 CEO's, it is time to advocate for public health... the health and welfare of your workers and their families...
And your business...depends on it.",pro-mitigation,,anti-mitigation,pro-mitigation,pro-mitigation
"Vaccines should be mandatory not only to prevent infection. More importantly, vaccines will prevent the virus from circulating and thus mutating to variants that may evade the vaccines. So, the idea that well, I'm vaccinated so who cares, doesn't quite work. 

If a private business owner who is a baker can refuse to bake cake for a gay couple, then employers and companies can require vaccines. If a private company can choose to prohibit health insurance coverage for contraception for its employees, then it can mandate vaccines. If a private company can compel drug testing for its employees, then it can compel vaccines.",pro-mitigation,,pro-mitigation,pro-mitigation,pro-mitigation
"The Supreme Court ruled that an employer (Hobby Lobby) didn't have to provide birth control because it went against the beliefs of the mains stockholders of a corporation.

Isn't this the same thing?  Or does it sound different now that it effects men?",unclear,,unclear,unclear,anti-mitigation
"Although bars and restaurants may be contributing to these flare ups equally, it doesn’t make sense that they would be and it’s sloppy not to tease that out.",unclear,,unclear,unclear,unclear
"The Delta Variant is very contageous and dangerous.  As a result, I think all people, even those vaccinated, should wear masks inside.  As for outside, no, unless you are at a pubic event like a baseball game or a fireworks display.  We need to stop the spread, and having a vaccination is NOT a guarantee you won't get (or spread) the delta variant.",pro-mitigation,,pro-mitigation,pro-mitigation,pro-mitigation
"It should be an ""on-site"" requirement, period. No religious or health exception. If you won't or can't, you can be remote until you either find other employment or show a positive antibody (but negative PCR) indicating you've been infected in the past.",anti-mitigation,,pro-mitigation,unclear,pro-mitigation
"I think companies should be much more concerned if they do not require all employees to get vaccinated. If the unvaccinated infect other  employees or customers, lawsuits will ensue.
Companies have historically require all sorts of certain behaviors for employees to follow. 
Schools have always required children be vaccinated before school attendance.
Since there are so many people who shun vaccines for whatever reason, there needs to be pressure put on them from multiple fronts to comply with public health measures.
This is a global pandemic which can again spiral out of control if we are not vigilant.
We do not want the risk of turning into India if the variants are allowed to get a strong foothold.",pro-mitigation,,pro-mitigation,pro-mitigation,pro-mitigation
"Most of us have gotten the flu at times in spite of getting the yearly flu vaccination—usually because the vaccine didn’t cover the latest variant or we were exposed to a large viral load in a poorly ventilated area or from a highly contagious person or place (hospital, prison, airplane, cruise ships). It’s a rare year when we don’t also contract at least one cold virus. 

The corona virus causing Covid-19 is a virus. It requires the same strategies used for any virus-caused disease — i.e., a vaccination if fortunate enough to have a vaccine, barriers as needed following a risk assessment for yourself and others (masks, gloves, distance) and good hygiene. 

Is there a chance you’ll catch the virus or any virus in spite of all this?  Yes.  Will the corona virus causing Covid-19 act in this same way?  Well, it’s a virus.  Will your chances of catching it be less? Yes.

There are vaccines for many viruses and some, like the flu vaccine, require yearly updates to manage the on-going mutations. The corona virus causing COVID-19 may be one of these.

Many viral diseases we in the US don’t think about are rampant and deadly in countries without access to vaccines (think measles) or health education. The fact is, viral diseases are not going away (influenzas, the common cold, viral pneumonia, measles, smallpox, hepatitis, herpes, polio, rabies, Bubonic plague, Ebola, Hanta fever, etc.) —we only control them as best we can and just maybe, like smallpox, we (almost) eradicate them.",pro-mitigation,,pro-mitigation,pro-mitigation,pro-mitigation
"JP Morgan, United Airlines, here is an idea:  the CEO and Boards of Directors state that it is the corporation's religious belief that vaccines are essential.  Bingo -- no one can mess with your vaccine requirement now.  They can refuse to bake cakes for gay couples while they are at it too, as it seems the establishment of religion is just fine by the First Amendment nowadays.  And why can't a corporation have a religious belief?  They have free speech rights (money = speech) and as Mitt Romney famously uttered, ""Corporations are people, too.""",pro-mitigation,,pro-mitigation,pro-mitigation,pro-mitigation
There is certainly no herd immunity to ignorance.,pro-mitigation,,unclear,pro-mitigation,unclear
"Costco, local grocery, pharmacy and weed dispensary.
That's it. Can't remember when I got gasoline the last time.
One car has been infested with ants due to lack of use.
We have been saving a lot of money. Spending bit more at Weed dispensary - Collinsville, IL. Good crowd management there.
MO passed an Constitutional Amendment to allow medical weed but the republican legislature, which opposed the measure, has continued to throw up roadblocks to implementation.
The current gov, Mike Parsons was LT gov when Eric Greitens (a noun, a verb, a Navy Seal) left office disgraced.
Parsons not popular but is a Republican being opposed by Nicole Galloway, State Auditor since  2015, very qualified CPA that with hope would clean up the corrupt mess in Jeff City.",unclear,,unclear,anti-mitigation,unclear
"I'm really disturbed by people commenting here. Seems a lot think you have a choice: get vaccinated or don't. Children can't be vaccinated. Some adults can't. Some adults don't develop antibodies.
I am vaccinated, but immunocompromised, didn't develop antibodies. Now I'm more fearful of going out than six months ago. Then we were largely in this together. Now we're all on our own. The unmasked and unvaccinated are the biggest threat, but the unmasked and vaccinated are still a small threat. And I can't tell the difference.
Just wear a mask. They're a minor inconvenience.",pro-mitigation,,pro-mitigation,unclear,pro-mitigation
Why do we allow unvaccinated persons enter international airports?,pro-mitigation,,anti-mitigation,pro-mitigation,pro-mitigation
"Virus variants nullify ""privacy."" No one has the right to harm others in any environment.",pro-mitigation,,unclear,pro-mitigation,pro-mitigation
The fear and anxiety caused by the constantly changing Covid paradigm—in my opinion—cause way more harm than Covid. Calm down and do what is right for you.,anti-mitigation,,pro-mitigation,unclear,unclear
"Maybe work on a multi-pronged approach? For those able to work at home, companies could require that they stay home for work. People with the public should be required to be tested every shift and work in full PPE garb, both paid for by the employee and the PPE obviously changed every day. 

It's not at all unreasonable for insurers to require vaccines for group health plans (once they are fully FDA approved and no longer on emergency status) or to apply deduction increases and coverage exceptions for those who've not gotten a vaccine and later contract Covid. 

Once people are given their ""choice"" I suspect we'll find many will re-think their priorities.",pro-mitigation,,pro-mitigation,unclear,pro-mitigation
"OSHA should require 100% mask wearing in all at-risk work places.  When 100% of employees are vaccinated, the requirement could be lifted. Don't leave public health decisions--decisions which affect every citizen's health--in the hands of thousands of non health professionals.",pro-mitigation,,pro-mitigation,pro-mitigation,pro-mitigation
"So, we are told to continue wearing masks and social distancing, and in some places, implementing restrictions or lockdowns…even though we were told that we should get the vaccine, that it’s safe and effective at preventing serious illness and death. So, if it is so effective, why the continued restrictions? And if it isn’t actually effective, then why I am getting a new (created in under a year), experimental, not fully FDA approved vaccine if nothing in my life changes, and I have to continue to social distance and mask? (Which is not healthy or normal for humans biologically wired to be social creatures). Businesses have been destroyed, poverty is worse, mental health issues are off the charts…..
And also, another thing I’ve thought about. Is it my duty as a vaccinated person to give up my life and freedoms to protect a person who chooses to not get a vaccine and may possibly get Covid and have a higher chance of dying? Perhaps there are some bleeding heart liberals who say, yes, it’s our job to protect the foolish. That’s nice of you, but there are a lot of people who disagree, including myself. 

There are risks in everything we do. I chose to take the risk of getting an unapproved vaccine even though there is a chance of developing health issues (blood clots or heart issues). I weighed it against the risks of getting Covid, and decided the risks seemed lower for the vaccine. I have friends/family who came to the opposite conclusion. People disagree. Get over it.",unclear,,anti-mitigation,anti-mitigation,pro-mitigation
I couldn't be more pleased with the decision of my employer to require vaccines.  I work on Broadway.  It is not just a safety issue; it is a requirement to open our shows profitably that audiences feel safe.  My livelihood and my rights depend on people being vaccinated.,pro-mitigation,,anti-mitigation,pro-mitigation,pro-mitigation
"When did the United States become such a selfish country?  Yes, there are valid reasons for some people not to get vaccinated.  But the rest of us can and should.  It will protect us and the people who cannot have the vaccination.  There are times, and this is one of them, when we need to act like we're a nation rather than a collection of disparate groups who would rather die than do something that makes sense for the whole.",pro-mitigation,,pro-mitigation,pro-mitigation,pro-mitigation
"Public health should never be a matter of personal choice. I can choose not to smoke, I can’t choose not being infected by an unvaccinated  co- worker in the next cubicle.

Our country has become the definition of idiocy and selfishness.

Vaccinate or stay out of public spaces - otherwise you are a murderer by negligence.",pro-mitigation,,pro-mitigation,pro-mitigation,pro-mitigation
"All you have to do is read a few of the stories of those who have caught the virus. Trump nearly died. A friend loss her sense of smell 6 month ago. Everything smells like stale smoke.

The CDC has to prove they can be trusted. Have they purged all the Trump-era politicos?",unclear,,unclear,unclear,pro-mitigation
"""Britain, where some two-thirds of the population have received at least one dose of the Pfizer-BioNTech or AstraZeneca vaccine and just under half have received two doses, is nonetheless grappling with a sharp rise in infections from the variant.""

It's not complicated. Countries that talked of the pandemic being ""over"" had to face facts. It may never be over, just controlled. That means everybody, vaccinated or not, has to make decisions based on epidemiological facts. Like continuing to wear masks indoors in public spaces social distancing and  normal hand washing. And getting ""the shots.""

People who consider it an outrage that medical science is trying to save their lives with reasonable rules are living in a weird fantasy land. If they have a heart attack would they click on a oonspiracy site for help?  If they're going into heart surgery, would they rejoice if the surgeon said ""hey bro, I'm with you!  I haven't bothered to scrub up, and nobody's going to tell me to put on a mask when I'm operating. High five!""",pro-mitigation,,pro-mitigation,pro-mitigation,pro-mitigation
"Once again US politics is clouding sound reason and public health safety . LA County Public health is looking at the numbers while NYC is too worried about optics and the mayor's race.   
  As of June 28th only 47% of the US or 153,776,118 people have been fully vaccinated, of which  55% of the population has received only 1 dose.
  The DELTA variant is more resistant to vaccines and spreads more rapidly 60% more transmittable than the ALPHA variant as it  mutates successfully.
  The partially vaccinated  25 million people risk getting of infection is 66% meaning about 17 million people partially vaccinated are going to be infected. 
   Now comes the very serious point for the NON vaccinated (about 1/2 of our country) if and when they will get this highly contagious variant 148 million people will be infected with DELTA COVID or another even worse variant as it evolves because it is. 
   So now 17 million plus 148 million or roughly 165 million will be severely vulnerable to this more infectious variant. 
 
    Now to the protection of vaccinated. We are not or will ever be immortal because of the RNA vaccines small study vaccine lasting defense. Pfizer and Moderna offer us protection at 88%(or less) leaving at least the 12% or 18 million more of the US population who are going to get ill.  
So with rough estimates --basically 183 million people are at risk here.
 I am vaccinated and I  am still going to wear a mask indoors.
The virus could be devolving but it is not.",pro-mitigation,,pro-mitigation,pro-mitigation,pro-mitigation
"Pre-pandemic I sat about six feet from a known anti-vaxxer in an open office with questionable ventilation. Even though I am vaccinated, I am not at all comfortable returning to this situation for eight hours a day when I have young children at home who can not yet get the vaccine. Yes, it is rare to transmit once vaccinated, but it can happen, especially with unknown new variants. 

As of now my employer is encouraging but not requiring the vaccine, which of course is their prerogative, but I hope they and other companies have plans to deal with situations like mine.",pro-mitigation,,pro-mitigation,pro-mitigation,pro-mitigation
"A company can refuse service to a gay couple based on religious beliefs, you should also be able to exempt unvaccinated people from your workplace. Just like not allowing smoking, nobody has the right to place another persons health in danger.",pro-mitigation,,pro-mitigation,unclear,pro-mitigation
So many comments here saying the CDC should not have changed their masking guidance. What happened to trusting the experts?,unclear,,unclear,unclear,anti-mitigation
"We never ate out more than a couple of times a year, when we had our two young children.  However, it never bothered me, as I liked to cook, and grew a lot of our own vegetables, and put them up for winter.  My husband had come from a family who ate a high fat, salt, sugar diet, and his father died of heart disease at the age of 40, so I wanted my two children to have a better outcome, and they have.  Everyone that eats out consumes more calories than they otherwise would if they ate at home.  However, the experts in this disease have said that we are 5 times more likely to get the virus from a family member, as each member has their own work, or school social circle, and their own friends social circle.  That is where all the cases are coming from.  A son who was an actively working doctor in South Florida, passed on the virus to his father, a retired physician, and both of them died.  In other words, the virus is so contagious, and often deadly to many healthcare personnel, who are subjected to a high virus count, day in, and day out.  Every contact with more than 2, presents more its own dangers.  Most nursing home residents who died were given the virus by those who worked in those institutions.  These people probably had spent considerable time with friends, either in bars, or at private homes.  The country is very selfish in how it is approaching this virus.  Not a lot of those, except in the older generation who realize the severity of the virus, and act accordingly.",pro-mitigation,,anti-mitigation,pro-mitigation,pro-mitigation
"Shame on the owners for not enforcing masks and distancing.  They do not care about customers or their employees they only care about money.  Sensible people are not participating.   Lesson to employees is get an education, learn a skill so you have more options in life than being a cashier or waiter.",pro-mitigation,,anti-mitigation,pro-mitigation,pro-mitigation
"Some restaurant patrons talk up a storm with each other or on their phones for extended periods of time. While some patrons may enjoy the scene, others may wish to stay away from the resulting aerosols. Thus, restaurant owners and health authorities should consider reserving certain sections of restaurants as “quiet zones,” especially during the busy dinning hours, thus reducing the amount of aerosols restaurant patrons would otherwise unwillingly inhale.",pro-mitigation,,pro-mitigation,unclear,unclear
"To all those who are not getting the shot because of political reasons, this is what Trump said on March 31.

""A lot of people have said, 'Ride it out. Don't do anything, just ride it out and think of it as the flu.' But it's not the flu. It's vicious,"" Trump declared at a White House Coronavirus Task Force Briefing. ""This is not the flu,"" added Trump, definitively. 

 <a href=""https://www.forbes.com/sites/tommybeer/2020/09/10/all-the-times-trump-compared-covid-19-to-the-flu-even-after-he-knew-covid-19-was-far-more-deadly/?sh=41df4de1f9d2"" target=""_blank"">https://www.forbes.com/sites/tommybeer/2020/09/10/all-the-times-trump-compared-covid-19-to-the-flu-even-after-he-knew-covid-19-was-far-more-deadly/?sh=41df4de1f9d2</a>

Get the shot.",pro-mitigation,,pro-mitigation,pro-mitigation,pro-mitigation
