text,annotation_7,annotation_8,annotation_9,annotation_78,annotation_62
"""Driven by a combination of anxiety and murky information about new virus variants, some New Yorkers aren't letting their guard down.""
This is just blatantly untrue, and an incredibly ungenerous and facially ludicrous summation of the reasons people are still wearing masks. Categorically ignoring all the valid reasons -- including a study of over 100 epidemiologists published in these very pages only last week! -- really confirms everything I already believe about the Times and where it seems to be going.",pro-mitigation,,anti-mitigation,unclear,anti-mitigation
"There is a difference between the vaccines that the schools require and this vaccine that companies are considering requiring. The vaccines the children get are usually for measles, mumps, rubella, and polio. It took 30 and 40  years to develop these vaccines and they,
 for the most part, provide you complete immunity from ever getting these diseases. This Covid vaccine is more like The flu vaccine. And we have no idea if it is permanent or if we will need a booster and we don’t know a whole lot about it. I just think that there’s a big difference and trying to compare the two is off target.",unclear,,pro-mitigation,anti-mitigation,unclear
"If this country is ever to reach herd immunity it is critical that businesses, schools, and universities require everyone to get vaccinated.

Otherwise we will be combatting this pandemic years from now and hundreds of thousands more will needlessly lose their lives.",pro-mitigation,,anti-mitigation,pro-mitigation,pro-mitigation
"Eating at a restaurant is beyond foolish right now. As someone who spent well over a decade battling a serious illness, I can’t comprehend why people would risk their health/lives to go out to eat!!!",pro-mitigation,,anti-mitigation,pro-mitigation,pro-mitigation
"Private companies have the right and the duty to implement safety restrictions to protect all its employees. There is no right to spread a deadly disease! There is no right to work at company X, Y, or Z. A no-vaccer has a choice, an absolute right to work somewhere else!",pro-mitigation,,pro-mitigation,pro-mitigation,pro-mitigation
"I contracted Covid-19 in March 2020, at a time when New York City was the epicenter of a virus that took over 30,000 lives in this city alone.
After spending two months in the hospital recovering from it, and one month in rehab learning how to walk again, I am not anxious to have another encounter with this virus -- nor would I likely survive it again.
For that reason, and given the fact that the Pandemic is still raging in other parts of the world with a host of variants yet to be diagnosed, I shall continue to follow the previous guidelines of the CDC, and err on the side of caution.
And there's nothing wrong with that.",pro-mitigation,,pro-mitigation,pro-mitigation,pro-mitigation
"it is actually not a tough decision at all. the headline should read ""some companies are so stupid that they are thinking about not requiring a vaccine for employees.",pro-mitigation,,anti-mitigation,pro-mitigation,pro-mitigation
"At this point let a considerable amount of the responsibility for the COVID-19 messed up restaurant industry, college sports, and the public schools be laid where it belongs; the nearly 6 months of idiotic pronouncements about SARS-Cov-19 and senseless mask resistance from DJT, Senators Sasse and Hawley and lame governors such as De Santis repeating every dumb, reckless, and foolish utterance by DJT.",pro-mitigation,,anti-mitigation,pro-mitigation,pro-mitigation
It's about personal choice. My body my choice. Keep your laws off my body. All the fear mongering and head shaking does nothing but promote more of the same. Fear is control. And control is power. If you control those around you with fear. You don't see the actions of those above you.,anti-mitigation,,anti-mitigation,anti-mitigation,anti-mitigation
"Why is the choice cast as  between “health advocate” and “big brother”?  Really the choice for companies will what is good for their business.  If I had a choice in airlines I’d sure go for the one where everyone is vaccinated. Better yet if they require passengers to be vaccinated.  

Same for hotels, restaurants, doctors and dentists offices.... you get my point. 

(And obviously there are the few that cannot get vaccine because of their health... they would be exempt.)",pro-mitigation,,pro-mitigation,pro-mitigation,pro-mitigation
"What this article fails to point out is that, like the flu shot, the  vax does not prevent you from getting the CV it only lessons the severity of the infection.  In other words nothing changes, so mandating it is a optic to placate the masses.",anti-mitigation,,pro-mitigation,anti-mitigation,anti-mitigation
"Thanks to the bug, I’ve learned to cook...",unclear,,unclear,unclear,unclear
"Yeah, we had one chance to break the back of this virus - if we could formulate a plan, cut its lifecycle, and get back to some normalcy.  

We get what we deserve as a population.",unclear,,pro-mitigation,pro-mitigation,unclear
"Big Brother when a company requires a vaccine to protect the workforce.  NOT Big Brother when a company requires a drug test to protect the workforce.

Why?",,,unclear,"unclear,unclear",unclear
"My wife and I are fully vaccinated. We have a 14 month old. We have jobs that have always been remote. Additionally, we are fortunate to have jobs where our bosses and colleagues are understanding of our need to take care of our baby. Like most parents, we are eager to send our daughter to day care, but, we aren't sure of whether the staff is vaccinated. Whilst I am aware of the low risk of my daughter contracting Covid-19, I am not too keen on how she could possibly be responsible for transmitting it to an elderly neighbor or grand parent. Surely, there is a big business opportunity for day care centers to require vaccination for their staff which in turn would spur parents like ourselves to send their kids.",pro-mitigation,,pro-mitigation,pro-mitigation,unclear
Fully vaccinated since April….this last Friday I sensed a cold coming on. Got tested last night and I’m positive.  This thing is still around and I fear there will be a small uptick in cases since the reopening and de-masking. I will start wearing masks again full time for a few more months.,pro-mitigation,,pro-mitigation,pro-mitigation,pro-mitigation
"All of this inability to think ahead and plan according has ended up costing more money and more lives. I blame the GOP for not paying people to stay home and business to stay closed. I blame the greedy millionaires who took PPP loans and then fired employees anyway. We need intelligent, ethical leadership. Conservatives have proven they don’t belong in government.",pro-mitigation,,unclear,unclear,unclear
Just seems like the free market is acting as it should. Why would I want employees who are potential covid cases when I can have employees who are vaccinated instead? If an employee chooses not to get vaccinated before going to work then they can make another choice in finding a new place of employment more amenable to their perspective,pro-mitigation,,pro-mitigation,pro-mitigation,pro-mitigation
"What’s with the NYT large story about Congressman Jeffries giving his support to Maya Wiley yet nothing on Kathryn Garcia getting the endorsement of the Daily News?! 

It would be interesting to see an assessment of which is more likely to garner more 1st choice rankings for either candidate. I’m going to say the DN for Garcia citywide, yet Jeffries endorsement and get out the vote efforts may be more impactful, especially among Blacks and in central Brooklyn.",unclear,,unclear,unclear,unclear
"My state is doing an outstanding job.  I see folks wearing masks in public everywhere.
However....I have not been to a restaurant to be seated indoors since early March.   
I still do not feel comfortable in an enclosed room with strangers to consume a meal.",pro-mitigation,,pro-mitigation,pro-mitigation,pro-mitigation
"People are weak.  They don't even have the will power to stay home for one short year.  

John McCain spent 6 years in a Vietnamese prison camp, and these American's can't survive without going out to a restaurant or bar.

Pathetic.",pro-mitigation,,anti-mitigation,pro-mitigation,pro-mitigation
"Does everyone have a driver’s license? If so, why? My understanding is that driver’s licenses are mandatory everywhere in the country. You would think that health of the community and responsibility are necessary there. Why not with a pandemic that has now killed 600,000 people? 

If they could trace the path of infection ending in death, what would be the charge?",pro-mitigation,,unclear,pro-mitigation,pro-mitigation
"Meanwhile in Massachusetts the moving 7 day average for Covid deaths is 2. New cases have been falling since April 11th and have been low for weeks. You have more chance being killed in a car wreck. If you are a healthy adult and haven’t been vaccinated by now, that’s your choice, but you have to live with the consequences. We must keep a close eye on the cases and deaths. However, we must get on with our lives. There are 9 deaths a day in Massachusetts during the regular flu season and we don’t do anything apart from offer flu jabs.",anti-mitigation,,unclear,anti-mitigation,anti-mitigation
"I really don't think it would be ethical to mandate a vaccine that is only provisionally approved under an emergency declaration. Once the vaccines are fully approved maybe but that is months, possibly years away and by then the urgency  will be gone.",anti-mitigation,,anti-mitigation,anti-mitigation,unclear
"Has everyone forgotten Typhoid Mary? Would she be a Republican? Would she be allowed to work and mingle with the population? 
I have no real problem with no vaccination just do what the insurance companies would do, rate the risk.....and charge accordingly.
I’m sure an actuarial table can be made to cover the bet.",pro-mitigation,,anti-mitigation,unclear,unclear
"Considering that I didn't even catch a cold over the past year, I may never go into a public setting without a mask again!  Just because one is vaccinated, doesn't mean one is not crawling with microbes.  Beside, a lot of folks spit when they talk, so I am no hurry for the masks to go away.",pro-mitigation,,pro-mitigation,pro-mitigation,pro-mitigation
"As usual in America we leave our life, liberty and happiness to the mercy of our corporate overlords.",unclear,,unclear,unclear,unclear
"Restaurants have devolved into ambush sites for class warfare where the ""oppressed"" are handling your food. Eating at restaurants was rarely healthier, cheaper or much faster than other options in the best of times.

That people are literally dying because of this habit, compulsion or delusion is fairly strong evidence that we are too often living unexamined lives. Yet many of us simultaneously defend nearly every aspect of these lives as if it were our own child. Our restaurant habit and reflexive defense of it may be killing us, but it is a symptom of a much deeper and more daunting societal problem.",unclear,,anti-mitigation,unclear,pro-mitigation
"I have not been out to a restaurant since the beginning of March. My husband and I  miss it greatly, but we live in Florida where masks are not even required when walking in our downtown area. This is an area teaming with restaurants, and people are even lined up at the ice cream shop hip-to-hip waiting to place their order. It is sad that so many people here are not taking the virus seriously. 
I also feel that our state has sent the message that we are a great alternative for people who want to get away this summer. 
Schools are also opening soon and must offer a five day school week per order of DeSantis. Alarming!",pro-mitigation,,anti-mitigation,pro-mitigation,pro-mitigation
"I would posit that the number of COVID cases from bars and indoor restaurants are underreported.  Patrons would likely self-select by their perceived invulnerability, i.e. slanting to younger age groups.  The younger age groups have a higher proportion of asymptomatic or lightly symptomatic cases. These cases would not be detected in statewide statistics, however later they can be passed to older folks at events such as family gatherings.  For this reason, a data-driven approach might fail to indict bars and restaurants as a major source of spread.",pro-mitigation,,anti-mitigation,unclear,unclear
"I would be strongly against the idea of mandating these COVID-19 vaccines but I think providing incentives to get vaccinated is a good idea.  One reason that comes to mind for why I think it would be very irresponsible to mandate is that there is not yet any long-term safety data on these vaccines.  

Maybe there are no serious long-term side effects that will emerge or maybe the chance of serious long-term side effects is very low, but at this point it is too early to know.  

I might feel differently about mandating a vaccine after it has already been properly tested over the long-term to show that there are no serious adverse long-term side effects.  Even then I would only support mandating under certain circumstances (ie: to travel internationally, to work in certain health care professions, etc.)",anti-mitigation,,pro-mitigation,unclear,unclear
"Finally, something of value come out of market-based health care. The reason I say that is because the “risk” in health insurance is employer-based, not the individual like car insurance.

If employers find a vaccinated employee group yields lower group premiums, they will mandate vaccination. They may try incentives (lower employee contributions) or penalties (higher employee contributions) first, but will resort to a ‘jab for a job’ quickly. Colleges already are doing it.

I don’t care if you get the vaccine because you think you’re forced, intimidated, or pressured into doing so. Just get the shot.",pro-mitigation,,pro-mitigation,pro-mitigation,pro-mitigation
"I will not be taking the risk of dining outdoors. I fear that people will walk by too close without a mask.

I see people congregating to do outdoor dining and it is reckless and not worth the risk. I understand the appeal, but as a covid survivor, even a mild case is no picnic.",pro-mitigation,,pro-mitigation,pro-mitigation,unclear
"To me it's simple.  If people want the right to decide whether or not to get vaccinated, then companies should have the right to give consequences based on that decision.  You don't want a shot?  That's fine, but you can't work here and endanger other employees.  It's not discrimination based on any protected class of views; it's a matter of public safety.

This petulant view that wants all the rights and none of the responsibilities is reminiscent of a spoiled adolescent.",pro-mitigation,,pro-mitigation,pro-mitigation,pro-mitigation
Companies that offer subsidized group health insurance should raise their rates to cover the additional costs they will bear for employees who will cost them money by being out and potentially impaired long-term when they get ill with COVid.  Individuals who can prove they and their families have been vaccinated can get a rebate on their Insurance.,pro-mitigation,,pro-mitigation,unclear,pro-mitigation
"The antivaxxers can exercise their rights to refuse and the employer can decide not to employ those who put other workers and clients in danger.  Further, someone who is charged with drunken driving may very well find that their auto insurance is cancelled.  Likewise I think should be the case for those choosing to refuse the COVID vaccine.  Let the antivaxxer have his/her/their way but their health insurance company (or Medicare/Medicaid) should be allowed to cancel their healthcare coverage.  Personal responsibility used to be the mantra of what is now the party of the former guy.",pro-mitigation,,pro-mitigation,unclear,pro-mitigation
"When I went to college, I had a medical exam with a list of required vaccines and had to have a tuberculosis test. As a freelancer, I literally couldn't get an in-person booking until I got the vaccine. I had my first haircut in a year and a half last week–when I called to make an appointment and asked about covid protocols, they reassured me that the all the staff had had the vaccine. My doctor still wears a mask, he says that with all the variants going around, he'll be practicing safety protocols.

When I visit my dad, his housekeeper drives me to the airport to make extra cash. The other day, she was preaching personal freedom and doesn't believe that masks helped and that Florida was better off opening up than all the states that closed down the other day. I'll be taking an Uber instead.",pro-mitigation,,unclear,anti-mitigation,pro-mitigation
"Having been vaccinated and currently WFH but waiting to return to office, I want my employer to require all employees to be vaccinated.  Understanding the challenges of making vaccines a requirement, especially since Trump made masks and vaccines a political issue, the alternative is to require every employee returning to the office to be vaccinated OR receive negative result from a weekly approved PCR test, and answer a series of daily health and social behavior questions in order to get an “approved for office” today. Moreover, vaccines and weekly testing requirements should, in my opinion, be extended not just to return to work but to all business activities, including travel and all internal/external meetings.

My employer is not planning to require vaccines or testing when offices reopen, rather it will rely on local infection data to make decisions, which are lagging statistics. Such an approach makes no sense to me as I believe wide spread return to office requirements without simultaneously requiring employees to be vaccinated will result in increased infections, which will lead to more variants. I imagine others feel like I do... I do not want to return to a life of no social interaction because a breakthrough variant has made the current vaccines ineffective. In my opinion anyone able but not willing to get the vaccine is un-American, selfish, unsupportive of businesses, and must believe a return to a mostly shutdown economy is acceptable... I do not!",pro-mitigation,,unclear,pro-mitigation,pro-mitigation
"I’m fully vaxed and gladly don my very comfortable and well designed KN95 mask (with changeable filters) in most stores. Doesn’t bother me one bit. If I see someone I know I’ll take it off to talk, provided they don’t appear ill.

My young kids play with other young kids, indoors and outdoors.  It’s a risk I’m willing to take because masking is robbing them of their youth and innocence at this point.  They need to see other kids expressions particularly a smile. They’ve already been scarred enough from the pandemic.

Still don’t go to crowded indoor restaurants and events but happy to sit on a patio with anybody who has their shots.  Anti-Vaxers really anger me.   I’m looking forward to seeing my first live concert with 2019 in the fall.  

Navigating the maze of covid safety is a little complicated at this stage. My sense is by the end of the summer science will have more answers and all restrictions will be a memory but indoor masks will stick around for a while so people don’t catch other respiratory illnesses. Not in social gatherings but in public places.

I’m neither Dem nor Rep but usually support the GOP.  DeSantis is probably my favorite politician at the moment and I don’t live in Florida.",pro-mitigation,,pro-mitigation,pro-mitigation,anti-mitigation
"Another article that totally fails to mention the vast number of restaurant workers who have not been put back on payroll, despite the high amount of PPP loans awarded to establishments and business owners. As a reader and former server, I would appreciate a deep analysis of these statistics. Do the work, NYT. I live in LA, and this is the majority of people I know who make their living working in the industry. They didn't even get the choice.",unclear,,unclear,unclear,unclear
No worries. President Trump stated last night that schools will reopen on Nov 4 because the decision to close schools is political.  I am certain that restaurants and bars have fallen prey to the same sinister politicians and on Nov 4 all will be well.,anti-mitigation,,anti-mitigation,anti-mitigation,pro-mitigation
"Most of the world's population is too young to remember ""smallpox"" and, for US, the vaccinations we ALL received as children, with periodic revaccinations (every 7 years as I recall). I read that, today,  some smallpox virus is in a freezer in some lab, in the event it might someday be useful--it is otherwise extinct on the face of the earth.

In today's world of nonsensical denial of facts and truth,  I worry that Covid will remain a significant cause of illness and death for many years.  Too many people have their own reasons to justify not getting vaccinated and our society seems to be  increasingly tolerant of the rights of these nuts, even if protecting their rights results in harm to others.

Science has made significant advances in recent years, but  common sense is clearly on the decline.",unclear,,anti-mitigation,pro-mitigation,pro-mitigation
The only masks which are truly effective are N95s. They are medical grade and protect the wearer and those nearby. The rest of the masks are minimally effective. The virus particles are so tiny that they can easily evade the “protection” of cloth and surgical  masks. One might as well slap a piece  of Swiss cheese on one’s face.,anti-mitigation,,pro-mitigation,pro-mitigation,pro-mitigation
"I am not an anti vaxxer.  I was vaccinated without one hesitation or doubt.  I am a nurse and want to see the end of COVID.  

But I cannot help but have doubts.  If by any chance COVID vaccine did result in some kind of birth defects if given to women of child bearing age who later bore children, who would be responsible?",pro-mitigation,,pro-mitigation,unclear,unclear
"Am I missing some obvious joke here? New York has had outdoor dining for what, over two months, in pretty full swing. Not ideal, but sufficient to get by for many (not all), and no increase in virus to speak of.

Please, all of you, ask yourselves why the articles you read and the conversations you keep don't emphasize the power simple creativity has over crisis, but rather accentuate failures.",unclear,,pro-mitigation,unclear,pro-mitigation
"At my hospital, Flu vaccines are not required, but if you opt not to get one you have to wear a mask the entire Flu season.  Now of course, everyone is wearing a mask, but someday in the future when COVID prevalence is reduced, maybe the non vaccinated people will continue to have to wear their masks.  And since COVID doesn't seem to have a season, that would means masks  forever.

I don't see why other institutions can't do the same - no masks for the vaccinated, eternal masks for the holdouts.",unclear,,anti-mitigation,unclear,unclear
"The pandemic is far from over.   As much as we would like it to be, it is not.

We have all those who refused to follow basic safety protocols to ""thank"" 🙄.

True, guidance from health authorities has at times been confusing but wearing a mask has been advised for quite a while. 

We who wear masks and take precautions have made it possible for the no maskers, anti vaxxers to go around bare faced and behave like nothing is threatening our health. 

I don't want them to thank us.  I would like them to put on a mask at the very least.

😷😷😷😷",pro-mitigation,,pro-mitigation,pro-mitigation,pro-mitigation
"So essentially, we are being asked- or told- to wear masks indoors because people who have not been vaccinated- of their own volition- are at risk. The words "" too bad, get smarter "" come to mind. If I am not at risk because I and my family choose to be vaccinated while others didn't and exercise risk behavior, it's time to say- enough. These are adults, they make choices, they want to die, pass it along , get seriously ill- this is America, that's their choice - we made ours, they made theirs, life -or not - goes on. Enough is enough. We have shown the efficacy of the vaccines, shown the downside, offered this vaccine for free.",pro-mitigation,,pro-mitigation,unclear,pro-mitigation
"My sister works for a large corporation who recently said to all the employees that the vaccine would not be required however if they did not get the vaccine they must bring in a negative covid-19 test at the start of each work week. Further, the employee was responsible for the cost of those tests.

So you don't want the vaccine fine but you're still going to offer some level of protection to the rest of the employees. This seems fair to me.",pro-mitigation,,pro-mitigation,pro-mitigation,pro-mitigation
"The US strategy is to allow the virus to run through the population, is that the price of freedom?",pro-mitigation,,anti-mitigation,pro-mitigation,pro-mitigation
"Imagine if Covid killed 50% of those who came in contact with it. There wouldn't be any debate about mandatory vaccinations under those circumstances. How low do the numbers have to go before the false dichotomy of ""health advocate or big brother"" becomes a relevant talking point? We are working on 600,000 dead Americans, here. Refusing to get a shot is grossly negligent; every corporation in the country should mandate that both employees and customers be fully vaccinated.",pro-mitigation,,unclear,pro-mitigation,pro-mitigation
